<?xml version="1.0" encoding="UTF-8"?>

<!DOCTYPE restaurante SYSTEM "./assets/restaurante.dtd">

<restaurante>
    <menu>
        <platosMenu>
            <platoMenu>
                <nombrePlato categoria="entrante"></nombrePlato>
                <listaIngredientes>
                    <ingredienteMenu></ingredienteMenu>
                    <ingredienteMenu></ingredienteMenu>
                    <ingredienteMenu></ingredienteMenu>
                </listaIngredientes>
                <precio moneda="EUR"></precio>
            </platoMenu>

            <platoMenu>
                <nombrePlato categoria="Bebida"></nombrePlato>
                <listaIngredientes>
                    <ingredienteMenu></ingredienteMenu>
                    <ingredienteMenu></ingredienteMenu>
                    <ingredienteMenu></ingredienteMenu>
                </listaIngredientes>
                <precio moneda="EUR"></precio>
            </platoMenu>        
        </platosMenu>
    </menu>
    

    <recetas>
        <receta>
            <nombreReceta comensal="adulto"></nombreReceta>
            <ingredientes>
                <ingrediente>
                   <nombreIngrediente cantidad=""></nombreIngrediente>
                </ingrediente>
            </ingredientes>
            <proceso>
                <paso></paso>
                <paso></paso>
                <paso></paso>
            </proceso>    
        </receta>

        <receta>
            <nombreReceta comensal="adulto"></nombreReceta>
            <ingredientes>
                <ingrediente>
                    <nombreIngrediente cantidad=""></nombreIngrediente>
                </ingrediente>
            </ingredientes>
            <proceso>
                <paso></paso>
                <paso></paso>
                <paso></paso>
            </proceso>    
        </receta>
    </recetas>


    <clientes>
        <cliente>
            <nombreCliente></nombreCliente>
            <telefono></telefono>
            <correo></correo>
            <pedidos>
                <pedido>
                    <fecha></fecha>
                    <platos>
                        <plato></plato>
                        <plato></plato>
                    </platos>
                </pedido>
            </pedidos>
        </cliente>

        <cliente>
            <nombreCliente></nombreCliente>
            <telefono></telefono>
            <correo></correo>
            <pedidos>
                <pedido>
                    <fecha></fecha>
                    <platos>
                        <plato></plato>
                        <plato></plato>
                    </platos>
                </pedido>
            </pedidos>
        </cliente>
    </clientes>
</restaurante>
